{
  "proof_surface_version": "0.1",
  "packet_id": "minimal-valid-packet",
  "surface": "minimal public release surface",
  "status": "ready",
  "claims": [
    {
      "claim": "The packet has one claim.",
      "evidence": "The claim object includes claim and evidence fields."
    }
  ],
  "checks": [
    {
      "tool": "fixture",
      "status": "pass",
      "summary": "minimal packet shape is present"
    }
  ],
  "action_items": []
}
